Name,Alternate Name,Abstract,Keywords,Source (organization),GN permalink,Image,CAT Beach Health,CAT Binational,CAT climatology,CAT Environmental,CAT habs,CAT Hydrologic,CAT Invasive Species,CAT Models,CAT Nearshore,CAT Nutrients,CAT observationsBuoys,CAT Other Resources,CAT QA / QC,CAT Satellite,CAT temperature,CAT water_quality
"45165 - Oregon, OH",Toledo Water Intake Crib Buoy (45165),"GLOS in-situ buoy in Lake Erie. Owned and maintained by LimnoTech. This buoy is sponsored by the City of Toledo Department of Public Utilities, Division of Water Treatment to monitor conditions near the water intake for the Collins Park Water Treatment Plant's intake crib located 3 miles offshore of Oregon, OH.",sea surface height|wave speed/direction|significant wave height|wave height|wave period|air temperature|atmospheric pressure|dew point temperature|wind speed/wind direction|pH|water temperature|conductivity|chlorophyll|turbidity|significant wave period|water temperature - surface|wind speed|wind from direction|air pressure at sea level|sea surface wave significant height|sea surface wind wave period|wind speed of gust|waves|buoys|observations|GLOS|NDBC ID 45165|HABs|Harmful Algal Blooms|waves|Lake Erie|Toledo|OH|Monroe|MI|Great Lakes,LimnoTech | City of Toledo,http://data.glos.us/metadata?uuid=305fd7a1-400b-4a31-8e5c-061f0b0e2046,http://data.glos.us:80/metadata/srv/eng/resources.get?uuid=305fd7a1-400b-4a31-8e5c-061f0b0e2046&fname=45165_mini_sm_s.png,,,x,,,,,,,,X,,,,x,
45171 - Granite Island Buoy,Granite Island Buoy (45171),"Monitoring buoy on Lake Superior near Granite Island (located about 12 miles northwest of Marquette in the Upper Peninsula, Michigan), owned and operated by Northern Michigan University. The buoy provides minute-by-minute observations of weather, water temperature and wave activity.",sea surface temperature|sea surface height|wave height|significant wave height|water temperature|wind speed/direction|wave period|air temperature|significant wave period|water temperature - surface|waves|buoys|observations|NDBC ID 45171|GLOS|Coastal Storms Program|Lake Superior|Granite Island|MI|Great Lakes,Northern Michigan University,http://data.glos.us/metadata?uuid=191cf778-6180-4404-925b-9ee5b06d31fd,http://data.glos.us:80/metadata/srv/eng/resources.get?uuid=191cf778-6180-4404-925b-9ee5b06d31fd&fname=45171_sm_s.png,,,x,,,,,,,,X,,,,x,
45172 - Grand Marais Buoy,Grand Marais Buoy (45172),"Monitoring buoy on Lake Superior near Grand Marais about 4 to 5 miles off shore, owned and operated by Northern Michigan University. The buoy provides minute-by-minute observations of weather, water temperature and wave activity.",air temperature|significant wave height|wave period|water temperature|wind speed/wind direction|atmospheric pressure|significant wave period|water temperature - surface|NDBC ID 45172|GLOS|Coastal Storms Program|observations|buoys|weather|waves|observations|Lake Superior|Grand Marais|MI|Great Lakes,Northern Michigan University,http://data.glos.us/metadata?uuid=e9eccc1b-167e-473f-82bf-bc226cf6c584,http://data.glos.us:80/metadata/srv/eng/resources.get?uuid=e9eccc1b-167e-473f-82bf-bc226cf6c584&fname=45172_sm_s.png,,,x,,,,,,,,X,,,,x,
ATW20,Milwaukee Buoy ATW20 (45013),"University of Wisconsin in-situ buoy near Atwater Park, WI.",atmospheric pressure|air temperature|dew point temperature|significant wave height|wave period|water temperature|wind speed/direction|air pressure|dew point|significant wave period|water temperature - surface|wind speed|wind gust|wind from direction|thermistor|NDBC ID 45013|ATW20|GLOS|buoys|observations|waves|Lake Michigan|Atwater Park|WI |Great Lakes,Northern Michigan University,http://data.glos.us/metadata?uuid=d53be051-b4df-454a-a374-b37ba39b23e3,http://data.glos.us:80/metadata/srv/eng/resources.get?uuid=d53be051-b4df-454a-a374-b37ba39b23e3&fname=45013--45014_sm_s.png,,,x,,,,,,,,X,,,,x,
Avon Lake Pump Station,Avon Lake Pump Station (leavon),"First in technology, Avon Lake is always working to balance cost, quality, efficiency, and environmental responsibility in everything we do. We strive to make our drinking water and wastewater treatment systems among the most progressive in the country. When zebra mussels invaded the Great Lakes in the ‘80s, Avon Lake was the region’s first utility to innovate methods of preventing mussels from obstructing raw water intakes. One of the newest threats we protect you from is toxic algae. We are putting effort into learning more about microcystin and other toxins found in harmful algal blooms (HABs) and are putting into pace this year new ‘clearwell’ storage tanks and will be adding additional pumping and emergency power generation factilities. We will also rehabilitate several filters to improve treatment ability and convert some existing basins to allow water to be recycled within the plant and reduce the burden on the wastewater treatment facility—thereby further reducing your wastewater’s impact on Lake Erie. ",water temperature|ph|conductivity|cyanobacteria (blue-green algae)|chlorophyll|water quality|dissolved gasses|leavon|Avon Lake Regional Water|HABs|Harmful Algal Blooms|dissolved oxygen|dissolved oxygen saturation|GLOS|Lake Erie|Great Lakes,Avon Lake Regional Water,http://data.glos.us/metadata?uuid=b303e50f-4615-4d13-bafa-dae868f9f65f,http://data.glos.us:80/metadata/srv/eng/resources.get?uuid=b303e50f-4615-4d13-bafa-dae868f9f65f&fname=sondes_sm_s.png,,,,,x,,,,,,X,,,,x,x
City of Toledo Water Intake Crib,City of Toledo Water Intake Crib (tolcrib),Data from Toledo Water Intake Crib (bottom) for inclusion in GLOS Harmful Algal Bloom Viewer.,ph|water temperature|conductivity|cyanobacteria (blue-green algae)|chlorophyll|turbidity|water quality|tolcrib|HABs|Harmful Algal Blooms|Water intake|LimnoTech|GLOS|Lake Erie|Great Lakes|City of Toledo,City of Toledo,http://data.glos.us/metadata?uuid=6349eecd-2b05-46d5-93ed-fe87f00e4702,http://data.glos.us:80/metadata/srv/eng/resources.get?uuid=6349eecd-2b05-46d5-93ed-fe87f00e4702&fname=sondes_sm_s.png,,,,,x,,,,,,X,,,,x,x
Elyria Pump Station,Elyria Pump Station (leelyria),"In the late 1800’s, the City of Elyria purchased property on the shore of Lake Erie, which is now inside the city limits of Lorain, to build a water plant and pump treated water to its citizens. Elyria is believed to be the first inland City in the United States to pump treated water from the Great Lakes. Among the latest improvements include a new High Service Pump House that pumps water from Lake Erie in Lorain to Elyria; new Low Service Screens and Pumps that screen out debris; and renovations to the Water Plant Laboratory. ",water temperature|ph|conductivity|cyanobacteria (blue-green algae)|chlorophyll|turbidity|water quality|leelyria|HABs|Harmful Algal Blooms|GLOS|Lake Erie|Great Lakes|City of Elyria,City of Elyria,http://data.glos.us/metadata?uuid=e22e93ec-cd9d-4173-8eb2-bd12040694ef,http://data.glos.us:80/metadata/srv/eng/resources.get?uuid=e22e93ec-cd9d-4173-8eb2-bd12040694ef&fname=sondes_sm_s.png,,,,,x,,,,,,X,,,,x,x
GB17,Green Bay Buoy GB17 (45014),University of Wisconsin in-situ buoy in Green Bay.,atmospheric pressure|air temperature|dew point temperature|significant wave height|wave period|wind speed/direction|water temperature|air pressure|dew point|significant wave period|water temperature - surface|wind speed|wind gust|wind from direction|thermistor|buoys|observations|waves|NDBC ID 45014|GB17|Lake Michigan|Green Bay|WI|Great Lakes,University of Wisconsin-Milwaukee,http://data.glos.us/metadata?uuid=fbf84dee-806a-4dd8-89f7-29b1f253556c,http://data.glos.us:80/metadata/srv/eng/resources.get?uuid=fbf84dee-806a-4dd8-89f7-29b1f253556c&fname=45013--45014_sm_s.png,,,x,,,,,,,,X,,,,x,
Gibraltar Island Station,Gibraltar Island Station (osugi),"Data from Ohio State University's Stone Laboratory, Gibraltar Island station for inclusino in GLOS' Harmful Algal Bloom Viewer.",water temperature|ph|conductivity|cyanobacteria (blue-green algae)|chlorophyll|turbidity|water quality|dissolved gasses|sugi|HABs|Harmful Algal Blooms|GLOS|dissolved oxygen|dissolved oxygen saturation|Lake Erie|Great Lakes|Gibraltar Island,Ohio State University Stone Laboratory,http://data.glos.us/metadata?uuid=92456797-d800-4d3b-8077-a14dae4987bc,http://data.glos.us:80/metadata/srv/eng/resources.get?uuid=92456797-d800-4d3b-8077-a14dae4987bc&fname=sondes_sm_s.png,,,,,x,,,,,,X,,,,x,
Grand Traverse Bay Observing System Station 1,Grand Traverse Bay Buoy GTBOSS1 (45020) (Decommissioned - Not Active),"Decommissioned buoy in Lake Michigan Grand Traverse Bay, operated by the University of Michigan Marine Hydrodynamics Laboratory.",air temperature|significant wave height|significant wave period|water temperature - surface|wind gust|wind speed|wind from direction|GLOS|waves|buoys|observations|NDBC ID 45020|Lake Michigan|Grand Traverse Bay|decommissioned|Great Lakes,University of Michigan Marine Hydrodynamics Laboratory,http://data.glos.us/metadata?uuid=b01bae39-002d-4412-9727-de0ce84cb142,http://data.glos.us:80/metadata/srv/eng/resources.get?uuid=b01bae39-002d-4412-9727-de0ce84cb142&fname=45020_mini_sm_s.png,,,x,,,,,,,,X,,,,x,
Grand Traverse Bay Observing System Station 2,Grand Traverse Bay Buoy GTBOSS2 (GTBM4) (Decommissioned - not active),"Decommissioned buoy in Lake Michigan Grand Traverse Bay, operated by the University of Michigan Marine Hydrodynamics Laboratory.",air temperature|wind speed/direction|air temperature|wind speed|wind from direction|NDBC ID GTBM4|GLOS|waves|buoys|observations|decommissioned|Grand Traverse Bay Observing System Station 2|Lake Michigan|Grand Traverse Bay|Great Lakes,University of Michigan Marine Hydrodynamics Laboratory,http://data.glos.us/metadata?uuid=25569832-9a54-41e4-94fa-4faa583fdc37,http://data.glos.us:80/metadata/srv/eng/resources.get?uuid=25569832-9a54-41e4-94fa-4faa583fdc37&fname=gtbm4_mini_sm_s.png,,,x,,,,,,,,X,,,,x,
Holland Buoy,Port Sheldon (Holland) buoy (45029),"GLOS in-situ buoy in Lake Michigan, between Grand Haven and Holland. Owned and maintained by LimnoTech.",air temperature|atmospheric pressure|significant wave height|wave period|wind speed/wind direction|dew point temperature|significant wave period|water temperature - surface|wind speed|wind from direction|air pressure at sea level|sea surface wave significant height|sea surface wind wave period|wind speed of gust|GLOS|NDBC ID 45029|waves|buoys|observations|Lake Michigan|Holland|Port Sheldon|MI|Great Lakes,LimnoTech  ,http://data.glos.us/metadata?uuid=461d9fec-4d48-49ba-946a-7f3614241105,http://data.glos.us:80/metadata/srv/eng/resources.get?uuid=461d9fec-4d48-49ba-946a-7f3614241105&fname=45029_sm_s.png,,,x,,,,,,,,X,,,,x,
leorgn,City of Oregon OH Pump Station (leorgn),"After lake water flows into the Low Pressure Pumping Station through the raw water intake line, the water is pumped to the water treatment plant on North Curtice Rd near Maumee Bay State Park. The pump station can be either locally or remotely operated by signals sent from the water treatment plant. The pumps located at the station range from 8 million gallons per day (MGD) to 17.2 MGD. Activated carbon is fed at this location to address taste and odor causing agents in the raw water. The building also contains an auxiliary power plant capable of generating total electrical power for the station. Since the onset of the Zebra Mussel infestation in Lake Erie, it is necessary to feed potassium permanganate to limit their growth in the intake conduit, the low pressure force main and the suction wells. ",water temperature|ph|conductivity|cyanobacteria (blue-green algae)|chlorophyll|turbidity|water quality|leorgn|City of Oregon|OH|HABs|Harmful Algal Blooms|GLOS|Lake Erie|Great Lakes,"City of Oregon, OH",http://data.glos.us/metadata?uuid=24d95510-9c9c-4126-adb6-590faebf2bb0,http://data.glos.us:80/metadata/srv/eng/resources.get?uuid=24d95510-9c9c-4126-adb6-590faebf2bb0&fname=sondes_sm_s.png,,,,,,,,,,,X,,,,,
Little Cedar Point,Little Cedar Point buoy (utlcp),"Researchers at the University's Lake Erie Center sensors monitor blue-green algae. Missions of the Center include researching environmental conditions in Maumee Bay and western Lake Erie as well as discerning linkages among land-use practices, water quality, habitat, economics, natural resources, sustainability, and environmental and public health. The UT HAB Buoy is sponsored by the Ohio Board of Regents and the University of Toledo. ",water temperature|ph|conductivity|cyanobacteria (blue-green algae)|chlorophyll|turbidity|water quality|dissolved gasses|utlcp|HABs|Harmful Algal Blooms|GLOS|dissolved oxygen saturation|University of Toledo|Lake Erie|Great Lakes|Little Cedar Point,University of Toledo,http://data.glos.us/metadata?uuid=02e401b4-79f0-4981-ad67-bd993080b655,,,,,,x,,,,,,X,,,,x,x
Marblehead Pump Station,Marblehead Pump Station (lemrbhd),"The Village of Marblehead public water system uses surface water drawn from an intake placed 550 feet out from shore in Lake Erie. The Board of Public Affairs and the Water Department are proud to be part of service to our community providing safe, high quality water 365 days a year. The village monitors and evaluates the water for biological and organic contaminants as required by the EPA.",water temperature|ph|conductivity|cyanobacteria (blue-green algae)|chlorophyll|water quality|lemrbhd|HABs|Harmful Algal Blooms|GLOS|Lake Erie|Great Lakes|Village of Marblehead,Village of Marblehead,http://data.glos.us/metadata?uuid=13961f4e-4ed6-47e7-a4cb-266acb485f37,http://data.glos.us:80/metadata/srv/eng/resources.get?uuid=13961f4e-4ed6-47e7-a4cb-266acb485f37&fname=sondes_sm_s.png,,,,,x,,,,,,X,,,,x,x
MTU Buoy,North Entry MTU buoy (45023),"GLOS in-situ buoy in Lake Superior North Keweenaw Peninsula, operated by Michigan Tech - Great Lakes Research Laboratory",atmospheric pressure|air temperature|dew point temperature|significant wave height|wave period|wind speed/wind direction|air pressure|dew point|significant wave period|water temperature - surface|wind speed|wind gust|wind from direction|thermistor|NDBC ID 45023|GLOS|MTU Buoy|buoys|waves|observations|Lake Superior|Keewenaw Waterway|MI|Portage Canal|Great Lakes,Michigan Tech University,http://data.glos.us/metadata?uuid=df2f09c6-d24c-4c2b-9f37-1300b84e1999,http://data.glos.us:80/metadata/srv/eng/resources.get?uuid=df2f09c6-d24c-4c2b-9f37-1300b84e1999&fname=45023_WaterWeatherBuoy_sm_s.png,,,x,,,,,,,,X,,,,x,
MTU1,South Entry buoy MTU1 (45025),"GLOS in-situ buoy in Lake Superior, South Entrance to Keweenaw Waterway, MI, operated by the Michigan Tech - Great Lakes Research Laboratory",atmospheric pressure|air temperature|dew point temperature|significant wave height|wave period|water temperature|wind speed/wind direction|air pressure|dew point|significant wave period|water temperature - surface|wind speed|wind gust|wind from direction|thermistor|NDBC ID 45025|GLOS|MTU1|waves|buoys|observations|Lake Superior|Keewenaw Waterway (South)|Great Lakes,Michigan Tech University,http://data.glos.us/metadata?uuid=ba54c35c-4271-40ba-94a5-35a7890e0c48,http://data.glos.us:80/metadata/srv/eng/resources.get?uuid=ba54c35c-4271-40ba-94a5-35a7890e0c48&fname=45025_IMG_4960_sm_s.png,,,x,,,,,,,,X,,,,x,
Muskegon Lake Buoy(GVSU),Muskegon Lake buoy (GVSU1),GVSU's Annis Water Resources Institute was awarded a 3-year grant from the US EPA Great Lakes Restoration Initiative Program to establish a buoy-based observatory in Muskegon Lake.,air temperature|dew point temperature|significant wave height|wave period|water temperature|wind speed/wind direction|water quality|humidity|air pressure|dew point|significant wave period|water temperature - surface|wind speed|wind gust|wind from direction|GVSU1|buoys|waves|observations|Lake Michigan|Muskegon|MI|Muskegon Lake|Great Lakes,Grand Valley State University,http://data.glos.us/metadata?uuid=7179ee32-7084-4460-92af-b16168ae3c41,,,,x,,,,,,,,X,,,,x,
NOAA GLERL WE2,NOAA GLERL WE2 (glerlwe2),"GLERL and CILER researchers are working to identify factors that influence harmful algal blooms (HABs) and to develop methods to forecast toxic cyanobacteria blooms. Research is focused on improving our ability to predict when algal blooms will occur, whether or not they are toxic, and their impact on human health. Field monitoring and observations collected by GLERL researchers keep track of nutrients at six master stations and two fixed moorings in western Lake Erie. The information gained from the field monitoring and observation assists in the development of probabilistic models for Lake Erie, which will be used to predict the magnitude of algal blooms while taking into account seasonal factors. GLERL and CILER's research and models support NOAA's National Centers for Coastal Ocean Science in monitoring and forecasting these harmful blooms through the the Harmful Algal Bloom Bulletin.",water temperature|ph|conductivity|cyanobacteria (blue-green algae)|chlorophyll|water quality|dissolved gasses|turbidity|glerlwe2|HABs|Harmful Algal Blooms|GLOS|dissolved oxygen|dissolved oxygen saturation|NOAA GLERL|Lake Erie|Great Lakes,"NOAA GLERL, University of Michigan - Cooperative  Institute for Limnology and Ecosystems Research  (CILER) ",http://data.glos.us/metadata?uuid=3fab4ec1-7983-41c4-98f7-4bb13231b167,,,,,,x,,,,,,X,,,,x,x
NOAA GLERL WE4,NOAA GLERL WE8 (glerlwe8),"GLERL and CILER researchers are working to identify factors that influence harmful algal blooms (HABs) and to develop methods to forecast toxic cyanobacteria blooms. Research is focused on improving our ability to predict when algal blooms will occur, whether or not they are toxic, and their impact on human health. Field monitoring and observations collected by GLERL researchers keep track of nutrients at six master stations and two fixed moorings in western Lake Erie. The information gained from the field monitoring and observation assists in the development of probabilistic models for Lake Erie, which will be used to predict the magnitude of algal blooms while taking into account seasonal factors. GLERL and CILER's research and models support NOAA's National Centers for Coastal Ocean Science in monitoring and forecasting these harmful blooms through the the Harmful Algal Bloom Bulletin.",water temperature|ph|conductivity|cyanobacteria (blue-green algae)|chlorophyll|water quality|dissolved gasses|turbidity|glerlwe4|HABs|Harmful Algal Blooms|GLOS|dissolved oxygen|dissolved oxygen saturation|NOAA GLERL|Lake Erie|Great Lakes,"NOAA GLERL, University of Michigan - Cooperative  Institute for Limnology and Ecosystems Research  (CILER) ",http://data.glos.us/metadata?uuid=3e3d8d19-fbfc-4a4d-b083-d48b4dbf818e,,,,,,x,,,,,,X,,,,x,x
NOAA GLERL WE8,NOAA GLERL WE8 (glerlwe8),"GLERL and CILER researchers are working to identify factors that influence harmful algal blooms (HABs) and to develop methods to forecast toxic cyanobacteria blooms. Research is focused on improving our ability to predict when algal blooms will occur, whether or not they are toxic, and their impact on human health. Field monitoring and observations collected by GLERL researchers keep track of nutrients at six master stations and two fixed moorings in western Lake Erie. The information gained from the field monitoring and observation assists in the development of probabilistic models for Lake Erie, which will be used to predict the magnitude of algal blooms while taking into account seasonal factors. GLERL and CILER's research and models support NOAA's National Centers for Coastal Ocean Science in monitoring and forecasting these harmful blooms through the the Harmful Algal Bloom Bulletin.",water temperature|ph|conductivity|cyanobacteria (blue-green algae)|chlorophyll|water quality|dissolved gasses|turbidity|glerlwe8|HABs|Harmful Algal Blooms|GLOS|dissolved oxygen|dissolved oxygen saturation|NOAA GLER|Lake Erie|Great Lakes,"NOAA GLERL, University of Michigan - Cooperative  Institute for Limnology and Ecosystems Research  (CILER) ",http://data.glos.us/metadata?uuid=9f4a657f-2648-49dd-917e-61c9c8205cea,,,,,,x,,,,,,X,,,,x,x
NOAA_RSC_A,Erie buoy RSC-A (45167),"In-situ buoy in Lake Erie near Presque Isle, operated by the Regional Science Consortium (RSC).",atmospheric pressure|air temperature|dew point temperature|significant wave height|wave period|water temperature|wind speed/wind direction|air pressure|waves|dew point|buoys|significant wave period|water temperature - surface|wind speed|wind gust|wind from direction|thermistor|NDBC ID 45167|NOAA_RSC_A|observations|RSC-A|Lake Erie|Presque Isle|OH|Great Lakes,Regional Science Consortium,http://data.glos.us/metadata?uuid=886d7a21-12df-4441-8717-98f10b7385f7,http://data.glos.us:80/metadata/srv/eng/resources.get?uuid=886d7a21-12df-4441-8717-98f10b7385f7&fname=45167_img_3384_sm_s.png,,,x,,,,,,,,X,,,,x,
North Keeweenaw Waterway,,,,,,,,,x,,,,,,,,X,,,,x,
Oneida Lake Buoy (ESF6),Oneida Lake buoy (ESF6),"In-situ buoy in Oneida Lake. Owned and maintained by Great Lakes Research Consortium and the State University of New York, College of Environmental Science and Forestry",air temperature|significant wave height|wave period|water temperature|wind speed/wind direction|atmospheric pressure|dew point temperature|significant wave period|water temperature - surface|wind speed|wind from direction|air pressure at sea level|sea surface wave significant height|sea surface wind wave period|wind speed of gust|ESF6|buoys|waves|observations|Lake Oneida|Great Lakes,"State University of New York College of Environmental Science and Forestry (SUNY-ESF), Great Lakes Research  Consortium ",http://data.glos.us/metadata?uuid=3802e73a-80a7-4d1a-89fd-54fcf09b7130,,,,x,,,,,,,,X,,,,x,
Oneida Lake Weather Station (ESF7),Oneida Lake Weather Station (ESF7),"Stationary weather station in Oneida Lake. Owned and maintained by Great Lakes Research Consortium and the State University of New York, College of Environmental Science and Forestry",air temperature|wind speed/wind direction|dew point temperature|wind speed|wind from direction|weather|observations|ESF7|Oneida Lake|Great Lakes,"State University of New York College of Environmental Science and Forestry (SUNY-ESF), Great Lakes Research  Consortium ",http://data.glos.us/metadata?uuid=c7230789-c800-42b8-90bb-94aaba973f57,,,,x,,,,,,,,X,,,,x,
"Oswego Buoy, Lake Ontario (ESF1)",Oswego buoy (ESF1),"In-situ buoy in Lake Ontario, Oswego. Owned and maintained by Great Lakes Research Consortium and the State University of New York, College of Environmental Science and Forestry",air temperature|significant wave height|wave period|water temperature|wind speed/wind direction|atmospheric pressure|dew point temperature|significant wave period|water temperature - surface|wind speed|wind from direction|air pressure at sea level|sea surface wave significant height|sea surface wind wave period|wind speed of gust|ESF1|buoys|waves|observations|Lake Ontario|Oswego|Great Lakes,"State University of New York College of Environmental Science and Forestry (SUNY-ESF), Great Lakes Research  Consortium ",http://data.glos.us/metadata?uuid=562f9b89-5232-450f-9b0f-d96cb29a5c8e,http://data.glos.us:80/metadata/srv/eng/resources.get?uuid=562f9b89-5232-450f-9b0f-d96cb29a5c8e&fname=ESF_1_sm_s.png,,,x,,,,,,,,X,,,,x,
Ottawa County Pump Station,Ottawa County Pump Station (leoc),"The Ottawa County Regional Water Treatment Plant radio telemetry system provides data communications between our elevated tanks, raw water pump station and the water plant. Monitoring of turbidity, particle counting and streaming current has been provided to enhance compliance with present and future water regulations. ",water temperature|ph|conductivity|cyanobacteria (blue-green algae)|chlorophyll|water quality|leoc|HABs|Harmful Algal Blooms|GLOS|Lake Erie|Great Lakes|Ottawa County|OH|Great Lakes,Ottawa County Regional Water Treatment Plant,http://data.glos.us/metadata?uuid=382b22c6-ff17-488b-8921-1d2dbf800ee5,http://data.glos.us:80/metadata/srv/eng/resources.get?uuid=382b22c6-ff17-488b-8921-1d2dbf800ee5&fname=sondes_sm_s.png,,,,,x,,,,,,X,,,,x,x
RECON Alpena-Thunder Bay Buoy,Alpena Thunder Bay RECON buoy (45162),"In-situ buoy in Lake Michigan, Alpena (Thunder Bay), operated by NOAA, Great Lakes Environmental Research Laboratory (GLERL).","atmospheric pressure|air temperature|dew point temperature|significant wave height|wave period|water temperature|wind speed/wind direction|air pressure|dew point|significant wave period|water temperature - surface|wind speed|wind gust|wind from direction|thermistor|NDBC ID 45162|GLERL|waves|buoys|observations|Lake Michigan|Alpena|MI|Thunder Bay,MI|Great Lakes",NOAA GLERL,http://data.glos.us/metadata?uuid=3f6216e2-38ae-41cd-8e42-41720633f272,http://data.glos.us:80/metadata/srv/eng/resources.get?uuid=3f6216e2-38ae-41cd-8e42-41720633f272&fname=45162photo-apn_sm_s.png,,,x,,,,,,,,X,,,,x,
